Title,Categories,First Paragraph
"Katër anglezë fajtorë për vrasjen e shqiptarit nga Kopliku, mesazhet në telefonin e viktimës zbuluan përfshirjen në trafikun e drogës","Aktualitet, Kryesore, Lajme, Të Fundit","Katër burra janë shpallur fajtorë për vrasjen e një shqiptari, i cili u godit me thikë pasi u ndalua me forcë në lindje të Londrës."
"Lëkundje tërmeti në vend, ja sa ishte magnituda","Aktualitet, Kryesore, Të Fundit",Vendi ynë është përfshirë nga lëkundje tërmeti këtë të martë.
"Cilin politikan besojnë shqiptarët më shumë? Sondazhi i Institutit Republikan Amerikan: Rama kryeson me 35%, Berisha 14%","Kryesore, Politikë, Të Fundit",Një sondazh i publikuar nga  Qendra e Institutit Ndërkombëtar Republikan (IRI) tregon se cilin nga politikanët mbështesin më shumë shqiptarët.
"Pak ditë para lënies së mandatit, Biden pritet të heqë Kubën nga lista e shteteve sponsorizuese të terrorizmit","Bota, Kryesore, Të Fundit","Administrata e presidentit Joe Biden njoftoi se do të heqë Kubën nga lista e shteteve që sponsorizojnë terrorin, një veprim i ndërmarrë në prag të lënies së pushtetit."
"Vuçiç do të ‘masë’ mbështetjen e popullit ndaj tij, i kërkon opozitës referendum","Kosova dhe Rajoni, Të Fundit","Presidenti i Serbisë, Aleksandar Vuçiç, ftoi më 14 janar përfaqësuesit e opozitës që të kërkojnë mbajtjen e një referendumi këshillues për qëndrimin e tij në këtë post, me qëllim që të përcaktohet mbështetja që ka në mesin e qytetarëve."
"Fiks Fare/ “E gjetën hajdutin e naftës”, gabimet e Albpetrolit dhe Tatimeve lënë pa pension 70 vjeçarin!","Aktualitet, Të Fundit","Fiks Fare denoncoi sorollatjet dhe zvarritjet e disa institucioneve, Albpetrolit, Tatimeve dhe Sigurimeve Shoqërore, të cilat me veprimet dhe mosveprimet e tyre sollën që një 70 vjeçar të mbesë pa pension prej 3 muajsh."
